{
  "$schema": "http://json-schema.org/draft-07/schema#",
  "$id": "https://github.com/dielman90-afk/CANSLIM-picks/blob/main/canslim-picks.schema.json",
  "title": "CANSLIM-Picks — Datenvertrag zwischen Analyse-Routine und Dashboard",
  "description": "Verbindliches Format von canslim-picks.json. Producer: die taegliche CANSLIM-Routine. Consumer: das Stock-Weather-Dashboard. Aenderungen hier sind Breaking Changes und muessen in beiden Projekten nachgezogen werden.",
  "type": "object",
  "required": ["updated", "market_signal"],
  "additionalProperties": true,
  "properties": {
    "updated": {
      "type": "string",
      "pattern": "^[0-9]{4}-[0-9]{2}-[0-9]{2}$",
      "description": "Datum des Laufs, JJJJ-MM-TT. Das Dashboard markiert den Stand als veraltet, wenn er aelter als 4 Tage ist."
    },
    "run": {
      "type": "integer",
      "minimum": 1,
      "description": "Fortlaufende Lauf-Nummer. Wird im Footer des Widgets angezeigt."
    },
    "market_signal": {
      "type": "string",
      "enum": ["GRUEN", "GRÜN", "GELB", "ROT", "GREEN", "YELLOW", "RED"],
      "description": "Marktampel nach O'Neil. Deutsch bevorzugt (GRUEN/GELB/ROT); die englischen Werte bleiben aus Kompatibilitaet zu aelteren Laeufen erlaubt. Das Dashboard normalisiert beides."
    },
    "market_note": {
      "type": "string",
      "description": "Begruendung der Marktampel (Langtext). Steht eingeklappt unter 'Marktlage & Auswahl', in Stichpunkte zerlegt an Labels in Grossbuchstaben ('FAZIT:', 'DATENLUECKEN:')."
    },
    "picks_note": {
      "type": "string",
      "description": "Einordnung der Auswahl insgesamt (Selektivitaet, Reihenfolge, Warnungen). Steht eingeklappt unter 'Marktlage & Auswahl', in Stichpunkte zerlegt an Labels in Grossbuchstaben ('BSVN ENTFERNT:', 'DATENHINWEIS:')."
    },
    "market_summary": {
      "type": "string",
      "description": "Optional, empfohlen: Marktlage in EINEM Satz (Ziel <= 140 Zeichen). Steht im Widget-Kopf. Fehlt das Feld, zeigt das Dashboard den FAZIT-Abschnitt bzw. den ersten Satz von market_note."
    },
    "picks_summary": {
      "type": "string",
      "description": "Optional, empfohlen: Einordnung der Auswahl in EINEM Satz (Ziel <= 140 Zeichen). Zweite Zeile im Widget-Kopf; fehlt sie, entfaellt die Zeile."
    },
    "picks": {
      "type": "array",
      "maxItems": 8,
      "description": "Kaufkandidaten. Das Dashboard zeigt maximal 8. Leeres Array ist zulaessig (z. B. Marktampel ROT).",
      "items": { "$ref": "#/definitions/eintrag" }
    },
    "watchlist": {
      "type": "array",
      "maxItems": 8,
      "description": "Beobachtungsliste: technisch interessant, aber (noch) kein Kauf. Wird ZUSAETZLICH zu den Picks angezeigt.",
      "items": { "$ref": "#/definitions/eintrag" }
    },
    "filtered_out": {
      "type": "array",
      "description": "Klartext-Begruendungen, warum Kandidaten aussortiert wurden. Wird als eigener Block am Ende des Widgets angezeigt.",
      "items": {
        "oneOf": [
          { "type": "string" },
          {
            "type": "object",
            "properties": {
              "ticker": { "type": "string" },
              "reason": { "type": "string" },
              "note":   { "type": "string" }
            },
            "additionalProperties": true
          }
        ]
      }
    }
  },
  "definitions": {
    "eintrag": {
      "type": "object",
      "required": ["ticker"],
      "additionalProperties": true,
      "properties": {
        "ticker":  { "type": "string", "minLength": 1, "description": "Boersenkuerzel, z. B. MOG.A." },
        "company": { "type": "string", "description": "Firmenname. Wird unter dem Ticker angezeigt. (Alt-Feldname `name` wird vom Dashboard weiterhin gelesen.)" },
        "name":    { "type": "string", "description": "VERALTET — bitte `company` verwenden. Nur noch aus Kompatibilitaet unterstuetzt." },
        "sector":  { "type": "string", "description": "Sektor/Branche. Wird als Chip auf der Karte angezeigt." },
        "status": {
          "type": "string",
          "description": "Stufe des Setups im Format 'STUFE -- Fliesstext'. Aus der STUFE (allem vor dem '--') leitet das Dashboard das farbige Badge ab. Erkannte Stufen: KUERZLICH AUSGEBROCHEN / AUSGEBROCHEN -> gruen 'Ausgebrochen'; DIREKT AM BREAKOUT-PUNKT / AM PIVOT -> gruen 'Am Pivot'; KURZ VOR DEM AUSBRUCH -> gelb 'Kurz vor Pivot'; UEBERDEHNT -> rot 'Ueberdehnt'."
        },
        "setup":       { "type": "string", "description": "Technische Analyse: Pivot, Basis, gleitende Durchschnitte, Volumen. Steht eingeklappt unter 'Details' als Block 'SETUP'." },
        "buy_trigger": { "type": "string", "description": "Konkrete Kaufregel inkl. Kaufzone und Stop. Steht eingeklappt unter 'Details' als Block 'KAUF-TRIGGER'." },
        "note":        { "type": "string", "description": "Freie Einordnung/Risiken. Steht eingeklappt unter 'Details' als Block 'NOTIZ' bzw. 'GRUND'." },
        "reason":      { "type": "string", "description": "Nur Watchlist: Ausschlussgrund. Alternative zu `note`." },
        "earnings_date": {
          "type": "string",
          "description": "Optional, empfohlen: Termin des naechsten Quartalsberichts als JJJJ-MM-TT. Das Dashboard zeigt den Chip 'Zahlen TT.MM. · in N T.', gelb ab 14 Tagen vorher. Nur ein bestaetigter oder klar datierter Termin; sonst Feld weglassen."
        },
        "canslim": {
          "type": "object",
          "description": "Die sieben CANSLIM-Kriterien, im Dashboard als Liste (Buchstabe | Bedeutung | Text) der Hauptinhalt der Karte. Je Buchstabe EIN kurzer Satz (Ziel <= 80 Zeichen, sichtbar ist eine Zeile). Text gilt als erfuellt; beginnt er mit 'SCHWACH -- ' (auch 'TEILWEISE -- ') wird der Buchstabe gelb, mit 'NICHT ERFUELLT -- ' rot, das Praefix selbst wird nicht angezeigt. M folgt immer der Marktampel. Booleans werden aus Kompatibilitaet weiter unterstuetzt.",
          "required": ["C", "A", "N", "S", "L", "I", "M"],
          "additionalProperties": false,
          "patternProperties": {
            "^[CANSLIM]$": { "type": ["string", "boolean"] }
          }
        },
        "price": {
          "type": "number",
          "description": "Optional. Letzter Kurs in USD. Fehlt er, blendet das Dashboard das Preisfeld aus (statt '—' anzuzeigen). Kurse veralten schnell — die konkreten Zahlen stehen ohnehin in `setup`/`buy_trigger`."
        },
        "pct_from_ath":  { "type": "number", "description": "Optional, nur Watchlist: Abstand zum Allzeithoch in Prozent. Erscheint als Badge." },
        "chart_pattern": { "type": "string", "description": "Optional: Chartformation, z. B. 'Cup with Handle'. Erscheint als Chip." },
        "pattern":       { "type": "string", "description": "Optional, maschinenlesbare Formation: kurz_vor_pivot | am_pivot | ausgebrochen." }
      }
    }
  }
}
