{
  "updated": "2026-10-26",
  "run": 133,
  "market_signal": "ROT",
  "market_summary": "ROT: Kein bestaetigter Follow-Through-Day gefunden, Kursdaten 19.-26.10. kaum verifizierbar, Marktbreite-Quellen widersprechen sich.",
  "market_note": "Marktampel bleibt ROT (7. Lauf in Folge unveraendert, seit Lauf 127). Fuer den Zeitraum 19.-26.10.2026 wurden in keiner Quelle belastbare, eindeutig datierte Schlusskurse fuer Dow/Nasdaq/S&P 500 gefunden; die zuletzt sicher datierten Werte stammen vom 16.10. (Nasdaq -2,14% auf 26.140,03, S&P 500 -1,09% auf 7.659,44, Dow -0,34% auf 52.002,41 -- der Verteilungstag, der den aktuellen Rallye-Versuch ausgeloest hat) bzw. 15.10. (Dow +1,1% auf 52.177,69, S&P 500 +0,3% auf 7.744,06). Ein gueltiger Follow-Through-Day nach O'Neil (Tag 4+ mit kraeftigem Kursgewinn bei steigendem Volumen, i.d.R. mind. 1,25-1,5% im Nasdaq) wurde fuer keinen Handelstag bis einschliesslich 26.10. gemeldet -- liegt weiterhin nicht vor, der Rallye-Versuch bleibt unbestaetigt. Marktbreite: eine Quelle nennt 36,5% der US-Aktien ueber der 200-Tage-Linie (Stand 16.10., deckt sich mit der zuvor verwendeten Zahl), eine zweite unverifizierte Quelle spricht von 5 Verteilungswochen 2026 und Nasdaq unter dem 40-Wochen-Durchschnitt -- undatiert, nicht belastbar. Keine verlaessliche taegliche Verteilungstage-Zaehlung verfuegbar. Naechste Katalysatoren: FOMC-Entscheidung Mittwoch 28.10.2026, grosse Big-Tech-Berichte (u.a. Microsoft, Alphabet, Meta, Apple, Amazon) in dieser Woche erwartet, Ergebnisse noch nicht auswertbar. FAZIT: Ohne bestaetigten Follow-Through-Day und ohne verifizierbare aktuelle Kursdaten keine Aufhellung erkennbar -- Ampel bleibt ROT, weiterhin keine neuen Vollpositionen. DATENLUECKEN: keine mit Datum verifizierbaren Schlusskurse fuer 19.-26.10., keine verlaessliche Verteilungstage-Zaehlung, Marktbreite-Zahl vom 16.10. nicht auf heute fortgeschrieben.",
  "picks_summary": "0 Picks + 1 Watchlist (HAS): SN/HALO/PAYC/TEVA wegen Berichtssperrfrist entfernt, keine neuen bestaetigten Kandidaten gefunden.",
  "picks_note": "0 Picks + 1 Watchlist (von 5 auf 1 reduziert). SN ENTFERNT: Bericht von SharkNinja offiziell fuer 04.11.2026 (vor Marktoeffnung) bestaetigt -- nur noch 9 Tage, damit innerhalb der zweiwoechigen Sperrfrist. HALO ENTFERNT: Bericht nicht offiziell bestaetigt, Schaetzungen (02. oder 05.11.2026) liegen beide innerhalb der Sperrfrist -- rein terminbedingt, CANSLIM-Kriterien unveraendert intakt (letzter bestaetigter Quartalsbericht vom 06.08. war ein deutlicher Beat mit angehobener Guidance). PAYC ENTFERNT: Bericht nicht offiziell bestaetigt, Schaetzungen 02.-05.11.2026 liegen ebenfalls innerhalb der Sperrfrist -- keine neuen negativen Nachrichten gefunden. TEVA ENTFERNT: Bericht von Teva offiziell fuer 03.11.2026 (7:00 Uhr ET) bestaetigt -- nur noch 8 Tage, Sperrfrist. HAS BLEIBT: Ausbruch vom 20.10. (7-Jahres-Hoch 109,52 USD) weiterhin ohne unabhaengig bestaetigte Folge-Kursdaten -- vor jedem Trade zwingend Live-Kurs pruefen; naechster Bericht erst Mitte Februar 2027, keine Sperrfrist in Sicht. SCOUTING WEITERER KANDIDATEN: CLS (Celestica) GEPRUEFT, NICHT AUFGENOMMEN -- berichtet HEUTE (26.10., nach Handelsschluss), reiner Sperrfrist-Fall, zudem widersprechende Kursangaben (373,09 vs. 312,35 USD); bei gutem Ergebnis in 1-2 Tagen erneut pruefen. ACN (Accenture) GEPRUEFT, NICHT AUFGENOMMEN -- nach Beat-and-Raise am 01.10. bereits ca. +29% binnen eines Monats gelaufen, deutlich ueberdehnt. BE (Bloom Energy) GEPRUEFT, NICHT AUFGENOMMEN -- keine verifizierbaren Oktober-Kursdaten, Bewertung an anderer Stelle als teuer (~160x Gewinn) eingestuft. CME Group GEPRUEFT, NICHT AUFGENOMMEN -- Kursreaktion auf Zahlen vom 21.10. nur rund +1%, kein Ausbruch. Berkshire Hathaway GEPRUEFT, NICHT AUFGENOMMEN -- Allzeithoch am 21.10., aber Low-Beta-Mega-Cap ohne CANSLIM-Wachstumsprofil. UEC (Uranium Energy) GEPRUEFT, NICHT AUFGENOMMEN -- negativer Gewinn je Aktie, C-Kriterium nicht erfuellt. Cameco GEPRUEFT, NICHT AUFGENOMMEN -- Bericht am 30.10., innerhalb der Sperrfrist. Fabrinet GEPRUEFT, NICHT AUFGENOMMEN -- keine verifizierbaren Oktober-Kursdaten, Pivot-Abstand nicht einschaetzbar. DATENHINWEIS: WebFetch weiterhin nicht nutzbar, ausschliesslich WebSearch-Synthese; die Suche lieferte fuer nahezu alle Watchlist- und Scouting-Kandidaten keine mit Datum verifizierbaren Kurse fuer die Woche 19.-26.10. -- durchgaengiges Datenproblem, kein Hinweis auf schwache Setups an sich. Qualitaet vor Quantitaet: ohne zwei unabhaengig bestaetigte, aktuell datierte Quellen wurde kein neuer Kandidat aufgenommen.",
  "picks": [],
  "watchlist": [
    {
      "ticker": "HAS",
      "company": "Hasbro, Inc.",
      "sector": "Konsumgueter / Spielwaren und Tabletop-Gaming (Wizards of the Coast, Magic: The Gathering)",
      "price": 109.52,
      "pattern": "ausgebrochen",
      "chart_pattern": "Ausbruch auf neues 7-Jahres-Hoch 109,52 USD am 20.10.2026 (+11,2%); seit Lauf 132 weiterhin keine neuere, verifizierbare Kursbestaetigung gefunden.",
      "status": "KUERZLICH AUSGEBROCHEN -- 7-Jahres-Hoch 109,52 USD am 20.10.2026 (+11,2%), seit Lauf 132 keine neuere Kursbestaetigung gefunden (jetzt ca. 4 Handelstage alt).",
      "setup": "Q3-Umsatz +15% YoY auf 1,6 Mrd. USD, operatives Ergebnis +46-52% YoY. Magic: The Gathering +34% auf Rekordniveau, FY26-Guidance angehoben, Rueckkaufziel verdoppelt (mind. 200 Mio. USD).",
      "pct_from_ath": 0,
      "reason": "KEIN NEUKAUF: Marktampel ROT. Ausbruch inzwischen ca. 4 Handelstage alt, weiterhin keine unabhaengig bestaetigten Folge-Kursdaten gefunden -- vor jedem Trade zwingend Live-Kurs pruefen. Naechster Bericht erst Mitte Februar 2027 -- keine Sperrfrist in Sicht.",
      "canslim": {
        "C": "Q3-EPS-Beat, Umsatz +15% YoY auf 1,6 Mrd. USD.",
        "A": "Guidance angehoben, operatives Ergebnis +46-52% YoY.",
        "N": "Magic: The Gathering +34% auf Rekordniveau.",
        "S": "Rueckkaufziel auf mind. 200 Mio. USD verdoppelt.",
        "L": "Neues 7-Jahres-Hoch mit Volumen, Marktfuehrer Tabletop-Gaming.",
        "I": "Mehrere Buy/Overweight-Ratings (Citi, Morgan Stanley, Roth).",
        "M": "NICHT ERFUELLT -- Marktampel ROT."
      }
    }
  ],
  "filtered_out": [
    "SN (SharkNinja) AUS WATCHLIST ENTFERNT: Bericht offiziell fuer 04.11.2026 bestaetigt -- 9 Tage, innerhalb der 14-Tage-Sperrfrist.",
    "HALO (Halozyme) AUS WATCHLIST ENTFERNT: Bericht nicht offiziell bestaetigt, Schaetzungen 02./05.11.2026 -- beide innerhalb der Sperrfrist; CANSLIM-Kriterien weiterhin intakt, rein terminbedingt.",
    "PAYC (Paycom) AUS WATCHLIST ENTFERNT: Bericht nicht offiziell bestaetigt, Schaetzungen 02.-05.11.2026 -- innerhalb der Sperrfrist.",
    "TEVA (Teva) AUS WATCHLIST ENTFERNT: Bericht offiziell fuer 03.11.2026 bestaetigt -- 8 Tage, innerhalb der Sperrfrist.",
    "CLS (Celestica) GEPRUEFT, NICHT AUFGENOMMEN: berichtet 26.10. nach Handelsschluss (Sperrfrist), zudem widersprechende Kursangaben (373,09 vs. 312,35 USD) -- bei gutem Ergebnis in 1-2 Tagen erneut pruefen.",
    "ACN (Accenture) GEPRUEFT, NICHT AUFGENOMMEN: nach Beat-and-Raise ca. +29% binnen eines Monats gelaufen -- deutlich ueberdehnt.",
    "BE (Bloom Energy) GEPRUEFT, NICHT AUFGENOMMEN: keine verifizierbaren Oktober-Kursdaten, Bewertung an anderer Stelle als teuer eingestuft.",
    "CME Group GEPRUEFT, NICHT AUFGENOMMEN: Kursreaktion auf Zahlen nur ca. +1% -- kein Ausbruch.",
    "Berkshire Hathaway GEPRUEFT, NICHT AUFGENOMMEN: Allzeithoch, aber Low-Beta-Mega-Cap ohne CANSLIM-Wachstumsprofil.",
    "UEC (Uranium Energy) GEPRUEFT, NICHT AUFGENOMMEN: negativer Gewinn je Aktie -- C-Kriterium verfehlt.",
    "Cameco GEPRUEFT, NICHT AUFGENOMMEN: Bericht am 30.10. -- innerhalb der Sperrfrist.",
    "Fabrinet GEPRUEFT, NICHT AUFGENOMMEN: keine verifizierbaren Oktober-Kursdaten, Pivot-Abstand nicht einschaetzbar.",
    "BSVN (Bank7) bleibt entfernt (Lauf 130): widersprechende Quelle zeigte Umsatzverfehlung und EPS-Ruckgang ggue. Vorjahr.",
    "FIX, JCI, NOC, TMO, IFF, EFX, BRZE, YPF, TEAM, DAC, FFIV, ANF, WELL, NAT, PANW, CRWD, PENG, HPE, NVDA, AMD, KEYS, CNC, HRTG, FTNT, ZBRA, IOT, TOST, GM, Carnival, Travel+Leisure, Vertiv, GE Vernova, Kratos, FICO, Ovintiv, Integer, UVE, ANET, URBN, Agilent, RTX, LMT, GD bleiben aus frueheren Laeufen ausgeschlossen (schwaches I-/S-/A-Kriterium, Sperrfrist-, Sektor-, Momentum- oder Datenrisiko).",
    "Large-Cap-52-Wochen-Hoch-Liste (v.a. Gesundheitssektor: Visa, Mastercard, AbbVie, Coca-Cola, Gilead, Pfizer, Altria, McKesson, ADP, Cardinal Health, Mettler-Toledo) weiterhin NICHT AUFGENOMMEN: keine verfuegbaren Pivot-/Volumen-Details.",
    "Profound Medical, Pacira Biosciences, Option Care Health bleiben ausgeschlossen (M&A-getrieben bzw. Katalysator zu alt).",
    "METHODIK-HINWEIS LAUF 133 (26.10.2026, Montag): Drei parallele Recherchen durchgefuehrt -- Marktstatus (Follow-Through-Day/Breadth), Nachpruefung der bestehenden Watchlist (SN/HALO/PAYC/TEVA/HAS) und gezieltes Scouting neuer Breakout-Kandidaten. Vier der fuenf bestehenden Watchlist-Werte mussten wegen bestaetigter oder geschaetzter Quartalsberichte innerhalb der 14-Tage-Sperrfrist entfernt werden, nicht wegen schwaecherer Fundamentaldaten. Scouting fand mehrere fundamental interessante Namen (Celestica, Accenture, Bloom Energy u.a.), aber keinen mit zwei unabhaengig bestaetigten, aktuell datierten Quellen fuer Pivot-Naehe -- entsprechend keine Neuaufnahme. Recherche ausschliesslich per WebSearch (WebFetch weiterhin nicht erreichbar); Kursdaten fuer 19.-26.10. waren durchgaengig schwer verifizierbar."
  ]
}
